track,artist,album,popularity_score,track_id,track_uri,spotify_link,preview,album_image_large,album_image_small,danceability,energy,key,loudness,mode,speechiness,acousticness,instrumentalness,liveness,valence,tempo,duration_ms,time_signature,lyrics
One More Hour,Tame Impala,The Slow Rush,60,0mO6oS60RST2sWmN2FKknP,spotify:track:0mO6oS60RST2sWmN2FKknP,https://open.spotify.com/track/0mO6oS60RST2sWmN2FKknP,https://p.scdn.co/mp3-preview/c2b7cc13042e44e397e9a9d20d39780d8e985240?cid=01e5c3c39a334ae78bf5becf053ad2d5,https://i.scdn.co/image/ab67616d00001e0258267bd34420a00d5cf83a49,https://i.scdn.co/image/ab67616d0000485158267bd34420a00d5cf83a49,0.647,0.398,4,-8.63,1,0.0283,0.108,0.107,0.148,0.32,102.029,432560,4,"just a moment right before all the song and dance wasn't brave enough to tell you but there ain't gonna be another chance it's not long until (all that i have) and everything's still (one more hour) minutes are racing, whatever i've done i did it for love (all that i have) i did it for fun (one more hour) couldn't get enough (all that i have) i did it for fame (one more hour) but never for money not for houses, not for her not for my future children until now  how could i love again? how could i ever ask for more? and to the road ahead into a life i can't ignore (lose her) how could i love again? (move on) how can i walk this path for sure? (lose her) with no more time to spare (move on) i know the answer more and more  as long as i can, long as i can spend some time alone as long as i can, long as i can be the man i am  ooh, life is strange for one more hour i can rage for one more hour  as long as i can (lose her), as long as i can (move on) spend some time alone as long as i can (lose her), as long as i can (move on) remember who i am as long as i can (lose her), as long as i can (move on) spend some time alone as long as i can (how could i love again?), as long as i can be the man i am  just a minute, fella, right before you go out there all your voices said you wouldn't last a minute bare one more hour and you'll know your life is one to share just a minute, baby, right before we go from here all those people said we wouldn't last a minute near i'm with you and i could roll into another year just a minute, fella, right before you go out there all your voices said you wouldn't last a minute bare one more hour and you'll know your life is one to share just a minute, baby, right before we go from here all those people said we wouldn't last a minute near i'm with you and i could roll into another year just a minute, fella, right before you go out there all your voices said you wouldn't last a minute bare"
It Might Be Time,Tame Impala,The Slow Rush,66,558ubozatFQlweufvHa3Ip,spotify:track:558ubozatFQlweufvHa3Ip,https://open.spotify.com/track/558ubozatFQlweufvHa3Ip,https://p.scdn.co/mp3-preview/6fb8702a677de7f4bf28044414338dc8786f1f01?cid=01e5c3c39a334ae78bf5becf053ad2d5,https://i.scdn.co/image/ab67616d00001e0258267bd34420a00d5cf83a49,https://i.scdn.co/image/ab67616d0000485158267bd34420a00d5cf83a49,0.585,0.781,2,-3.808,1,0.0457,0.021,0.000187,0.627,0.336,115.946,273027,4,"something doesn't feel right that's enough for one night hope y'all get home alright there i go, blame it on the weather  but hey, there's nothin' wrong i'm only tired of all these voices always sayin' nothing lasts forever  it might be time to face it it ain't as fun as it used to be, no you're goin' under you ain't as young as you used to be it might be time to face it you ain't as cool as you used to be, no you won't recover you ain't as young as you used to be  it might be time to face it it might be time to face it  i've been lost before so tell me it's not over 'cause i finally got somethin' goin' and suddenly all my friends are growin' up and movin' on i must be missin' somethin'  'cause i just wanna keep this dream alive for now don't they know nothin' lasts forever?  it might be time to face it nobody knows what you've come here for, no you're goin' under they roll their eyes when you're at the door  it might be time it might be time to face it (yeah) you may as well embrace it  we promise to come visit (yeah) it might be time  it might be time to face it (yeah) you ain't as fun as you used to be you won't recover you ain't as cool as you used to be  it might be time to face it it might be time to face it"
Is It True,Tame Impala,The Slow Rush,73,6RZmhpvukfyeSURhf4kZ0d,spotify:track:6RZmhpvukfyeSURhf4kZ0d,https://open.spotify.com/track/6RZmhpvukfyeSURhf4kZ0d,https://p.scdn.co/mp3-preview/972b2f6697d175064e993f748d436b1adb55ce6b?cid=01e5c3c39a334ae78bf5becf053ad2d5,https://i.scdn.co/image/ab67616d00001e0258267bd34420a00d5cf83a49,https://i.scdn.co/image/ab67616d0000485158267bd34420a00d5cf83a49,0.731,0.664,0,-5.474,1,0.0302,0.00307,0.35,0.133,0.661,118.018,239267,4,"we were hangin' in the morning feelin' all different kinds of things we were talkin' about everything from the past to the happenin' we started talkin' 'bout devotion the kind that goes on eternally and i tell her i'm in love with her but how can i know that i'll always be?  she just said, ""is it true? is it true? tell me now"" that's a promise i can't make and i won't validate was i in some kind of mood? i don't know, i don't care now i'm sleeping in my room, here i am, back again she's in my—  i was happy just listening no intention to be mentioning we started talkin' 'bout the future 'bout the notion i was motioning i'm just so terrified to face her like any moment i might wake up 'cause she's the only thing i think of i told my mother that i love her  she just said, ""is it true? is it true? tell me now"" that's a promise i can't make and i won't validate was i being immature? i don't know, i don't care now i'm sleeping in my room, here i am, back again she's in my— in my—  i said, ""we'll see, we'll see"" (in my—) we'll see ah, we'll see we'll see we'll see, we'll see, we'll see see how it goes until we know what the future holds ah, we'll see we'll see we'll see, we'll see, we'll see"
Lost In Yesterday,Tame Impala,The Slow Rush,74,5JWPUEov2wlX7c0jhYZpeB,spotify:track:5JWPUEov2wlX7c0jhYZpeB,https://open.spotify.com/track/5JWPUEov2wlX7c0jhYZpeB,https://p.scdn.co/mp3-preview/79ae58907e563abfd151d91a4b8d11e00911459b?cid=01e5c3c39a334ae78bf5becf053ad2d5,https://i.scdn.co/image/ab67616d00001e0258267bd34420a00d5cf83a49,https://i.scdn.co/image/ab67616d0000485158267bd34420a00d5cf83a49,0.569,0.84,1,-4.123,1,0.118,0.0295,0.000118,0.0995,0.749,183.059,249587,3,"when we were livin' in squalor, wasn't it heaven? back when we used to get on it four out of seven now even though that was a time i hated from day one eventually, terrible memories turn into great ones  so if they call you, embrace them if they hold you, erase them  'cause it might've been somethin', who's to say? does it help to get lost in yesterday? and you might've missed somethin', don't say 'cause it has to be lost in yesterday and you're gonna have to let it go someday you've been diggin' it up like groundhog day 'cause it might've been somethin', don't say 'cause it has to be lost in yesterday  matty said life didn't go the way that he planned it said, ""oh, what i'd give to start over, boy, i demand it so, what was i ever afraid of? why did i worry? and why was i ever so brainless? head in a flurry""  'cause if they call you, embrace them if they stall you, erase them  'cause it might've been somethin', who's to say? does it help to get lost in yesterday? and you might've missed somethin', don't say 'cause it has to be lost in yesterday and you're gonna have to let it go someday you've been diggin' it up like groundhog day 'cause it might've been somethin', don't say 'cause it has to get lost in yesterday  if it calls you, embrace it if it haunts you, face it  i know it's mad, i understand it's only snakes and ladders the period you never had there's only one that matters  and if it calls you, embrace it if it holds you, erase it replace it"
On Track,Tame Impala,The Slow Rush,62,0IuE6FnXPCdZ8NLuuvJRhb,spotify:track:0IuE6FnXPCdZ8NLuuvJRhb,https://open.spotify.com/track/0IuE6FnXPCdZ8NLuuvJRhb,https://p.scdn.co/mp3-preview/2f87a9bb0212a9d4038c3bc1e04b0499ef23c154?cid=01e5c3c39a334ae78bf5becf053ad2d5,https://i.scdn.co/image/ab67616d00001e0258267bd34420a00d5cf83a49,https://i.scdn.co/image/ab67616d0000485158267bd34420a00d5cf83a49,0.388,0.648,2,-5.578,1,0.038,0.116,4.19e-06,0.082,0.112,163.861,301787,4,"i close my front door and turn on the light i let out a breath and hold in a sigh ain't nothin' new, ain't that much in sight and if i'm counting days, dream fruition ain't what it's looking like  but strictly speaking, i'm still on track strictly speaking, i'm holding on more than a minor setback but strictly speaking, i'm still on track and all of my dreams are still in sight 'cause strictly speaking, i've got my whole life i lost a wheel a while back but strictly speaking, i'm still on track challenges falling in my lap strung out again, but still on track  i know it's unrealistic, over-optimistic i know i tried before this, i know it's nearly august i know i can't ignore this, looking forward to all this sayin', ""babe, i just adore this"" and, ""babe, can we afford this?"" i know it's been a slow year, nothin' much to show here i didn't really go for it, so not a lot to show for it  the hardest part is over, adjusting makes it slower so glad you're comin' over, a wall to bring us closer the world ain't waitin' for ya, nothin' to lose it over we're just a little older, the rest comes easy the rest comes easy  ('cause life's like that) but strictly speaking, i'm still on track strictly speaking, i'm holding back troubles keep falling in my lap yeah, but strictly speaking, i'm still on track so tell everyone i'll be alright 'cause strictly speaking, i've got my whole life more than one major setback but strictly speaking, i'm still on track (yeah)  the hardest part is over, adjusting makes it slower (ooh) so glad you're comin' over, a wall to bring us closer (still on track, motherfucker) the world ain't waitin' for ya, nothin' to lose it over we're just a little older, the rest gets easy the rest gets easy"
Tomorrow's Dust,Tame Impala,The Slow Rush,61,666PdikRnUzdvjT9p5wWND,spotify:track:666PdikRnUzdvjT9p5wWND,https://open.spotify.com/track/666PdikRnUzdvjT9p5wWND,https://p.scdn.co/mp3-preview/51cb9324908f620a04513107fc69cf10366b5693?cid=01e5c3c39a334ae78bf5becf053ad2d5,https://i.scdn.co/image/ab67616d00001e0258267bd34420a00d5cf83a49,https://i.scdn.co/image/ab67616d0000485158267bd34420a00d5cf83a49,0.616,0.804,0,-5.568,1,0.0427,0.0124,0.0998,0.553,0.627,99.002,326840,4,"there's no use trying to relate to that older soul and no use trying to debate that they've got it wrong there's no use pining for love when you're on your own and no use crying outside if nobody's home there's no use flying to the moon if they won't believe so why do i go wrong on repeat?  i was blinded by a memory like it's someone else, like it wasn't me and there's every chance i'll be learning fast and the day will come and then it will pass  what do you want when i say i won't? and though i try, i do the same, as though i must and in the air of today is tomorrow's dust  there's no use trying to relate to that older soul and no use biding your time if the bell is tolled  i was blinded by a memory like it's someone else, like it wasn't me and there's every chance i'll be learning fast and the day will come and then it will pass  sympathy for the fauna fragile life in the sauna in the sea getting warmer endlessly 'round the corner  and though i try, i do the same, as though i must and in the air of today is tomorrow's dust"
Breathe Deeper,Tame Impala,The Slow Rush,71,3LbZIhU0smEU5SUnxod4j4,spotify:track:3LbZIhU0smEU5SUnxod4j4,https://open.spotify.com/track/3LbZIhU0smEU5SUnxod4j4,https://p.scdn.co/mp3-preview/ea09978f0e7b33b6091c514ecc7285328b7d747e?cid=01e5c3c39a334ae78bf5becf053ad2d5,https://i.scdn.co/image/ab67616d00001e0258267bd34420a00d5cf83a49,https://i.scdn.co/image/ab67616d0000485158267bd34420a00d5cf83a49,0.664,0.848,11,-4.51,0,0.0322,0.0245,0.000127,0.172,0.502,104.998,372867,4,"if you think i couldn't hold my own, believe me, i can believe me, i can, believe me, i can if it ain't so awful and we're all together, i can believe me, i can, believe me, i can if you think i couldn't roll with you, believe me, i can believe me, i can, believe me, i can if ideally we should feel like this forever, i can believe me, i can, believe me, i can  (and she said) seems you're coming on breathe a little deeper should you need to come undone and let those colours run (and she said) now you're having fun so do this and get through this and come find me when you're done so we can be as one  if you think i couldn't hold my own, believe me, i can believe me, i can, believe me, i can if you need someone to tell you that you're special, i can believe me, i can, believe me, i can if you need someone to carry on, believe me, i can believe me, i can, believe me, i can if you think no one is feeling what you're feeling, i am believe me, i am, believe me, i am  and the groove is low  (and she said) seems you're coming on breathe a little deeper should you need to come undone and let those colours run now you're having fun so do this and get through this (and the groove is low) and come find me when you're done so we can be as one  telemona telemona, oh and the groove is low telemona and the groove is low  seems you're coming on breathe a little deeper should you need to come undone (telamona) and let those colours run now you're having fun (telamona) do this and get through this and until we see the sun (and the groove is low) you're my number one  telemona (and she said) and the groove is low telemona and the groove is low  we're both adults while we behave like children long as we got enough to keep on living telemona telemona"
Posthumous Forgiveness,Tame Impala,The Slow Rush,68,1KcOU0q9AMXV9xi4tSzzCc,spotify:track:1KcOU0q9AMXV9xi4tSzzCc,https://open.spotify.com/track/1KcOU0q9AMXV9xi4tSzzCc,https://p.scdn.co/mp3-preview/f6261db077a795ea07d5dbe19be508ac351750aa?cid=01e5c3c39a334ae78bf5becf053ad2d5,https://i.scdn.co/image/ab67616d00001e0258267bd34420a00d5cf83a49,https://i.scdn.co/image/ab67616d0000485158267bd34420a00d5cf83a49,0.367,0.613,7,-5.646,1,0.0297,0.0508,0.00171,0.282,0.0966,153.978,366067,4,"ever since i was a small boy no one else compared to you, no way i always thought heroes stayed close whenever troubled times arose i didn't know ain't always how it goes  every single word you told me i believed without a question, always to save all of us, you told us both to trust but now i know you only saved yourself  did you think i'd never know? never wise up as i grow?   and you could store an ocean in the holes in any of the explanations that you gave and while you still had time, you had a chance but you decided to take all your sorrys to the grave  did you think i'd never know? never wise up as i grow? did you hope i'd never doubt? never one day work it out?   you were runnin' for cover doin' like any other fallin' out with a lover you didn't know that i suffered what a thing to discover if there was time to recover one-on-one with each other just a boy and a father what i'd give for another everything that i have wouldn't need this for long never speak of the time that you left us alone me and steve on our own  i wanna tell you 'bout the time wanna tell you 'bout my life wanna play you all my songs learn the words, sing along  (this time) wanna tell you 'bout the time (i know) i was in abbey road or the time that i had mick jagger on the phone i thought of you when we spoke  wanna tell you 'bout the time wanna tell you 'bout my life wanna play you all my songs hear your voice sing along  (this time) i wanna say, ""it's all right"" (i know) you're just a man after all and i know you had demons i got some of my own i think you passed them along  wanna tell you 'bout the time wanna tell you 'bout my life wanna play you all my songs and hear your voice sing along"
Borderline,Tame Impala,The Slow Rush,81,5hM5arv9KDbCHS0k9uqwjr,spotify:track:5hM5arv9KDbCHS0k9uqwjr,https://open.spotify.com/track/5hM5arv9KDbCHS0k9uqwjr,https://p.scdn.co/mp3-preview/14d0b15905c1d5b01266e042613ab5bf4af9c85d?cid=01e5c3c39a334ae78bf5becf053ad2d5,https://i.scdn.co/image/ab67616d00001e0258267bd34420a00d5cf83a49,https://i.scdn.co/image/ab67616d0000485158267bd34420a00d5cf83a49,0.621,0.873,5,-3.067,0,0.0369,0.0406,9.1e-06,0.0824,0.873,97.96,237800,4,"ah  gone a little far gone a little far this time for something how was i to know? how was i to know this high came rushing?  we're on the borderline caught between the tides of pain and rapture possibly a sign i'm gonna have the strangest night on sunday  there i go quite a show for a loner in l.a.​ askin' how i managed to end up in this place and i couldn't get away  we're on the borderline dangerously far and all forgiven there's gonna be a fight gonna be a price to pay on monday (if you and i get comfortable) we're on the borderline (on the borderline) caught between the tides of pain and rapture then i saw the time (then i saw the time) watched it speedin' by like a train, like a train  will i be known and loved? is there one that i trust? starting to sober up has it been long enough? will i be known and loved? little closer, close enough i'm a loser, loosen up setting free, must be tough will i be known and loved? is there one that i trust? if there's room, room for doubt as within, as without ya will i be so in love? any closer? close enough shout out to what is done r.i.p., here comes the sun here comes the sun  gone a little far gone a little far this time with something how could i have known? how was i to know this high came rushing? i said, ""come with me outside"" i need to clear my mind, this weight is crushing do you see the light, oh coming from their eyes? oh no and i couldn't get away  we're on the borderline (ooh) gets me every time, these close encounters just to know i can (just to know i can) once again, i am alone  will i be known and loved? is there one that i trust? starting to sober up has it been long enough? will i be known and loved? little closer, close enough i'm a loser, loosen up setting free, must be tough (i was fine without ya) will i be known and loved? l.a. really messed me up and it isn't cut and dry conversation, well, i tried (i was fine without ya) will i be? stay right here any closer? bad idea shout out to what is done r.i.p., here comes the sun (i was fine without ya) will i be known and loved? is there one that i trust? starting to sober up has it been long enough?"
Instant Destiny,Tame Impala,The Slow Rush,62,6WCXBUFa0z3l9DoOY3k5Xe,spotify:track:6WCXBUFa0z3l9DoOY3k5Xe,https://open.spotify.com/track/6WCXBUFa0z3l9DoOY3k5Xe,https://p.scdn.co/mp3-preview/7c856235d9174221d8aeb5638cfbb15df2e5ce74?cid=01e5c3c39a334ae78bf5becf053ad2d5,https://i.scdn.co/image/ab67616d00001e0258267bd34420a00d5cf83a49,https://i.scdn.co/image/ab67616d0000485158267bd34420a00d5cf83a49,0.381,0.829,10,-4.564,1,0.0598,0.0226,0.000274,0.402,0.509,165.935,194707,4,"i'm about to do something crazy, no more delayin' no destiny is too far we can get a home in miami, go and get married tattoo your name on my arm  this traffic doesn't seem quite as annoying quite alright, quite alright, sittin' here yes, reminiscent, i think this is different i know this is different (i'm about to) let's cause something permanent just so we know we can  i'm about to do something crazy, no more delayin' no destiny is too far did you say, ""and here comes forever""? oh, here forever, let go of me with open arms  we'll be lovers until the end of time (i'm about to) i see it now i see just how you're so right (i'm about to) you're so clear now  i'm about to do something crazy, no more delayin' no destiny is too far we can get a home in miami, go and get married tattoo your name on my arm  let's drink this magic potion of love and devotion and then let's see how it goes"
One More Year,Tame Impala,The Slow Rush,63,5ozqshq2dtU7SYCpCBu0NE,spotify:track:5ozqshq2dtU7SYCpCBu0NE,https://open.spotify.com/track/5ozqshq2dtU7SYCpCBu0NE,https://p.scdn.co/mp3-preview/48a27627f2c365c4736f304081247deabbaa0de2?cid=01e5c3c39a334ae78bf5becf053ad2d5,https://i.scdn.co/image/ab67616d00001e0258267bd34420a00d5cf83a49,https://i.scdn.co/image/ab67616d0000485158267bd34420a00d5cf83a49,0.602,0.88,1,-5.414,1,0.0354,0.057,0.46,0.284,0.493,114.009,324013,4,"do you remember we were standing here a year ago? our minds were racing and time went slow if there was trouble in the world, we didn't know if we had a care, it didn't show but now i worry our horizon's been nothing new 'cause i get this feeling and maybe you get it too we're on a rollercoaster stuck on its loop-de-loop 'cause what we did one day on a whim has slowly become all we do  i never wanted any other way to spend our lives i know we promised we'd be doing this 'til we die and now i fear we might ooh, now i fear we might  but it's okay i think there's a way why don't we just say, ""one more year""? (one more year) not worryin' if i get the right amount of sleep (one more year) not carin' if we do the same thing every week (one more year) of livin' like i'm only livin' for me (one more year) of never talkin' about where we're gonna be (one more year) one more year of livin' like the free spirit i wanna be  we got a whole year (one more year) fifty-two weeks seven days each (one more year) four seasons, one reason, one way one year (one more year), one year one year, from today from today  i never wanted any other way to spend our lives now one of these is gonna be the last for all time for all time one more year"
Many Men (Wish Death),50 Cent,Get Rich Or Die Tryin',69,2I9foKseoFQh07p6sD2voE,spotify:track:2I9foKseoFQh07p6sD2voE,https://open.spotify.com/track/2I9foKseoFQh07p6sD2voE,https://p.scdn.co/mp3-preview/01e209d8c8c1fa7a5801f05b2d1075ed03944f81?cid=01e5c3c39a334ae78bf5becf053ad2d5,https://i.scdn.co/image/ab67616d00001e02f7f74100d5cc850e01172cbf,https://i.scdn.co/image/ab67616d00004851f7f74100d5cc850e01172cbf,0.653,0.826,6,-2.93,0,0.354,0.0153,0.00146,0.131,0.416,108.52,256227,5,"man, we gotta go get somethin' to eat man, i'm hungry as a motherfucker ayo man, damn what's takin' homie so long, son? 50, calm down, he coming (*nine gunshots*) ahh, ohh! what the fuck?! ah, son, pull off, pull off  many men wish death upon me blood in my eye, dawg, and i can't see i'm tryin' to be what i'm destined to be and niggas tryin' to take my life away (c'mon) i put a hole in a nigga for fuckin' with me my back on the wall, now you gon' see better watch how you talk when you talk about me ‘cause i'll come and take your life away  many men many, many, many, many men wish death 'pon me lord, i don't cry no more don't look to the sky no more have mercy on me  now man, these pussy niggas puttin' money on my head go on and get your refund, motherfucker, i ain't dead i'm the diamond in the dirt that ain't been found i'm the underground king, and i ain't been crowned when i rhyme, somethin' special happened every time i'm the greatest, somethin' like ali in his prime i walk the block with the bundles i've been knocked on the humble swing the ox when i rumble, show your ass what my gun do got a temper, nigga, go 'head, lose your head turn your back on me, get clapped and lose your legs i walk around, gun on my waist, chip on my shoulder till i bust a clip in your face, pussy, this beef ain't over  many men many, many, many, many men wish death 'pon me lord, i don't cry no more don't look to the sky no more have mercy on me have mercy on my soul somewhere my heart turned cold have mercy on many men many, many, many, many men wish death 'pon me  sunny days wouldn't be special if it wasn't for rain joy wouldn't feel so good if it wasn't for pain death gotta be easy, ‘cause life is hard it'll leave you physically, mentally, and emotionally scarred this is for my niggas on the block twistin' trees in cigars for the niggas on lock doin' life behind bars i don't say ""only god can judge me,"" ‘cause i see things clear crooked-ass crackers will give my black-ass a hundred years i'm like paulie in goodfellas, you can call me the don like malcolm by any means with my gun in my palm slim switched sides on me, let niggas ride on me i thought we was cool, why you want me to die, homie?  many men many, many, many, many men wish death 'pon me lord, i don't cry no more don't look to the sky no more have mercy on me have mercy on my soul somewhere my heart turned cold have mercy on many men many, many, many, many men wish death 'pon me  every night i talk to god, but he don't say nothin' back i know he protectin' me, but i still stay with my gat in my nightmares, niggas keep pullin' tecs on me psychic says some bitch done put a hex on me the feds didn't know much when 'pac got shot i got a kite from the pens that told me tut got knocked i ain't gon' spell it out for you mu'fuckas all the time are you illiterate, nigga? you can't read between the lines? in the bible, it says what goes around, comes around ""hommo"" shot me, three weeks later he got shot down now it's clear that i'm here for a real reason ‘cause he got hit like i got hit, but he ain't fuckin' breathin'  many men many, many, many, many men wish death 'pon me lord, i don't cry no more don't look to the sky no more have mercy on me have mercy on my soul somewhere my heart turned cold have mercy on many men many, many, many, many men wish death 'pon me"
