track,artist,album,popularity_score,track_id,track_uri,spotify_link,preview,album_image_large,album_image_small,danceability,energy,key,loudness,mode,speechiness,acousticness,instrumentalness,liveness,valence,tempo,duration_ms,time_signature,lyrics
Oh Girl,The Chi-Lites,The Ultimate Chi-Lites,45,5tcR6nVpY1JRDyDcK0K60f,spotify:track:5tcR6nVpY1JRDyDcK0K60f,https://open.spotify.com/track/5tcR6nVpY1JRDyDcK0K60f,https://p.scdn.co/mp3-preview/3728c02e485e95a15434aa02b470475d2c990852?cid=01e5c3c39a334ae78bf5becf053ad2d5,https://i.scdn.co/image/ab67616d00001e0254e863427f6d665cf3713d6e,https://i.scdn.co/image/ab67616d0000485154e863427f6d665cf3713d6e,0.422,0.486,0,-9.866,0,0.0282,0.296,0.0,0.108,0.53,134.587,217520,4,"oh, girl i'd be in trouble if you left me now 'cause i don't know where to look for love i just don't know how  oh, girl how i depend on you to give me love when i need it right on time you would always be  all my friends call me a fool they say let the woman take care of you so i try to be hip and think like the crowd but even the crowd can't help me now, oh  oh, girl tell me, what am i gonna do i know i've got a guilty face girl, i feel so out of place, oh, yeah yeah  (du-du, du-du, du-du) don't know where to go, who to see, yeah (du-du, du-du, du-du)  oh, girl i guess i better go i can save myself a lot of useless tears girl, i've gotta get away from here  oh, girl pain will double if you leave me now 'cause i don't know where to look for love and i don't, i don't know how  oh, yeah, mmhmm oh, girl why do i love you so? yeah (du-du, du-du, du-du) better be on my way, i can't stay, oh yeah (du-du, du-du, du-du) have you ever seen such a helpless man, oh no"
Runaway,Kanye West,My Beautiful Dark Twisted Fantasy,75,3DK6m7It6Pw857FcQftMds,spotify:track:3DK6m7It6Pw857FcQftMds,https://open.spotify.com/track/3DK6m7It6Pw857FcQftMds,https://p.scdn.co/mp3-preview/3b9daa4ad7b5d0b59cd84858823fec284bf16413?cid=01e5c3c39a334ae78bf5becf053ad2d5,https://i.scdn.co/image/ab67616d00001e02d9194aa18fa4c9362b47464f,https://i.scdn.co/image/ab67616d00004851d9194aa18fa4c9362b47464f,0.374,0.568,1,-3.825,0,0.109,0.219,0.00219,0.513,0.111,84.733,547733,4,"look at ya, look at ya, look at ya, look at ya look at ya, look at ya, look at ya, look at ya look at ya, look at ya, look at ya, look at ya look at ya, look at ya, look at ya, look at ya (ladies and gentlemen, ladies, ladies and gentlemen)  and i always find, yeah, i always find something wrong you been puttin' up with my shit just way too long i'm so gifted at finding what i don't like the most so i think it's time for us to have a toast  let's have a toast for the douchebags let's have a toast for the assholes let's have a toast for the scumbags every one of them that i know let's have a toast for the jerk-offs that'll never take work off baby, i got a plan run away fast as you can  she find pictures in my email i sent this bitch a picture of my dick i don't know what it is with females but i'm not too good at that shit see, i could have me a good girl and still be addicted to them hoodrats and i just blame everything on you at least you know that's what i'm good at  and i always find, yeah, i always find yeah, i always find something wrong you been puttin' up with my shit just way too long i'm so gifted at finding what i don't like the most so i think it's time for us to have a toast  let's have a toast for the douchebags let's have a toast for the assholes let's have a toast for the scumbags every one of them that i know let's have a toast for the jerk-offs that'll never take work off baby, i got a plan run away fast as you can  run away from me, baby ah, run away run away from me, baby (look at ya, look at ya, look at ya) run away when it starts to get crazy (look at ya, look at ya, look at ya) then run away babe, i got a plan, run away as fast as you can run away from me, baby run away run away from me, baby (look at, look at, look at, look at, look at, look at, look at ya) run away when it starts to get crazy (look at ya, look at ya, look at ya, look at ya) why can't she just run away? baby, i got a plan run away as fast as you can (look at ya, look at ya, look at ya)  twenty-four seven, three sixty-five, pussy stays on my mind i-i-i-i did it, alright, alright, i admit it now pick your next move, you could leave or live with it ichabod crane with that motherfuckin' top off split and go where? back to wearing knockoffs? haha, knock it off, neimans, shop it off let's talk over mai tais, waitress, top it off hoes like vultures, wanna fly in your freddy loafers you can't blame 'em, they ain't never seen versace sofas every bag, every blouse, every bracelet comes with a price tag, baby, face it you should leave if you can't accept the basics plenty hoes in the baller-nigga matrix invisibly set, the rolex is faceless i'm just young, rich, and tasteless, p  never was much of a romantic i could never take the intimacy and i know i did damage 'cause the look in your eyes is killing me i guess you knew of that advantage 'cause you could blame me for everything and i don't know how i'ma manage if one day, you just up and leave  and i always find, yeah, i always find something wrong you been puttin' up with my shit just way too long i'm so gifted at finding what i don't like the most so i think it's time for us to have a toast  let's have a toast for the douchebags let's have a toast for the assholes let's have a toast for the scumbags every one of them that i know let's have a toast for the jerk-offs that'll never take work off baby, i got a plan run away fast as you can"
Stan,Eminem,The Marshall Mathers LP,80,3UmaczJpikHgJFyBTAJVoz,spotify:track:3UmaczJpikHgJFyBTAJVoz,https://open.spotify.com/track/3UmaczJpikHgJFyBTAJVoz,https://p.scdn.co/mp3-preview/bf13d42615a883ac55907ff694c267b2494a2376?cid=01e5c3c39a334ae78bf5becf053ad2d5,https://i.scdn.co/image/ab67616d00001e02dbb3dd82da45b7d7f31b1b42,https://i.scdn.co/image/ab67616d00004851dbb3dd82da45b7d7f31b1b42,0.78,0.768,6,-4.325,0,0.238,0.0371,2.34e-06,0.518,0.507,80.063,404107,4,"my tea's gone cold i'm wondering why i got out of bed at all the morning rain clouds up my window and i can't see at all and even if i could it'd all be gray but your picture on my wall it reminds me that it's not so bad, it's not so bad my tea's gone cold i'm wondering why i got out of bed at all the morning rain clouds up my window and i can't see at all and even if i could it'd all be gray but your picture on my wall it reminds me that it's not so bad, it's not so bad  dear slim, i wrote you, but you still ain't callin' i left my cell, my pager and my home phone at the bottom i sent two letters back in autumn, you must not've got 'em there probably was a problem at the post office or somethin' sometimes i scribble addresses too sloppy when i jot 'em but anyways, fuck it, what's been up, man? how's your daughter? my girlfriend's pregnant too, i'm 'bout to be a father if i have a daughter, guess what i'ma call her? i'ma name her bonnie i read about your uncle ronnie too, i'm sorry i had a friend kill himself over some bitch who didn't want him i know you probably hear this every day, but i'm your biggest fan i even got the underground shit that you did with skam i got a room full of your posters and your pictures, man i like the shit you did with rawkus too, that shit was phat anyways, i hope you get this, man, hit me back just to chat, truly yours, your biggest fan, this is stan  my tea's gone cold i'm wondering why i got out of bed at all the morning rain clouds up my window and i can't see at all and even if i could it'd all be gray but your picture on my wall it reminds me that it's not so bad, it's not so bad  dear slim, you still ain't called or wrote, i hope you have a chance i ain't mad, i just think it's fucked up you don't answer fans if you didn't want to talk to me outside your concert, you didn't have to but you coulda signed an autograph for matthew that's my little brother, man, he's only six years old we waited in the blisterin' cold for you, for four hours, and you just said no that's pretty shitty, man, you're like his fuckin' idol he wants to be just like you, man, he likes you more than i do i ain't that mad, though i just don't like bein' lied to remember when we met in denver? you said if i'd write you, you would write back see, i'm just like you in a way: i never knew my father neither he used to always cheat on my mom and beat her i can relate to what you're sayin' in your songs so when i have a shitty day, i drift away and put 'em on ‘cause i don't really got shit else so that shit helps when i'm depressed i even got a tattoo with your name across the chest sometimes i even cut myself to see how much it bleeds it's like adrenaline, the pain is such a sudden rush for me see, everything you say is real, and i respect you ‘cause you tell it my girlfriend's jealous 'cause i talk about you 24/7 but she don't know you like i know you, slim, no one does she don't know what it was like for people like us growin' up you gotta call me, man, i'll be the biggest fan you'll ever lose sincerely yours, stan—p.s. we should be together too  my tea's gone cold i'm wondering why i got out of bed at all the morning rain clouds up my window and i can't see at all and even if i could it'd all be gray but your picture on my wall it reminds me that it's not so bad, it's not so bad  dear mr. i'm-too-good-to-call-or-write-my-fans this'll be the last package i ever send your ass it's been six months, and still no word—i don't deserve it? i know you got my last two letters, i wrote the addresses on 'em perfect so this is my cassette i'm sendin' you, i hope you hear it i'm in the car right now, i'm doin' 90 on the freeway hey, slim, i drank a fifth of vodka, you dare me to drive? you know the song by phil collins, ""in the air of the night"" about that guy who coulda saved that other guy from drownin' but didn't, then phil saw it all, then at a show he found him? that's kinda how this is: you coulda rescued me from drownin' now it's too late, i'm on a thousand downers now—i'm drowsy and all i wanted was a lousy letter or a call i hope you know i ripped all of your pictures off the wall i loved you, slim, we coulda been together—think about it! you ruined it now, i hope you can't sleep and you dream about it and when you dream i hope you can't sleep and you scream about it i hope your conscience eats at you and you can't breathe without me see, slim—shut up, bitch! i'm tryin' to talk hey, slim, that's my girlfriend screamin' in the trunk but i didn't slit her throat, i just tied her up—see? i ain't like you ‘cause if she suffocates she'll suffer more and then she'll die too well, gotta go, i'm almost at the bridge now oh, shit, i forgot—how am i supposed to send this shit out?!  my tea's gone cold i'm wondering why i got out of bed at all the morning rain clouds up my window and i can't see at all and even if i could it'd all be gray but your picture on my wall it reminds me that it's not so bad, it's not so bad  dear stan, i meant to write you sooner, but i just been busy you said your girlfriend's pregnant now, how far along is she? look, i'm really flattered you would call your daughter that and here's an autograph for your brother; i wrote it on a starter cap i'm sorry i didn't see you at the show, i must've missed you don't think i did that shit intentionally just to diss you but what's this shit you said about you like to cut your wrists too? i say that shit just clownin', dawg, come on, how fucked up is you? you got some issues, stan, i think you need some counselin' to help your ass from bouncin' off the walls when you get down some and what's this shit about us meant to be together? that type of shit'll make me not want us to meet each other i really think you and your girlfriend need each other or maybe you just need to treat her better i hope you get to read this letter, i just hope it reaches you in time before you hurt yourself, i think that you'll be doin' just fine if you relax a little, i'm glad i inspire you, but stan why are you so mad? try to understand that i do want you as a fan i just don't want you to do some crazy shit i seen this one shit on the news a couple weeks ago that made me sick some dude was drunk and drove his car over a bridge and had his girlfriend in the trunk, and she was pregnant with his kid and in the car they found a tape, but they didn't say who it was to come to think about it, his name was—it was you  damn…"
"Life Is Good (feat. Drake, DaBaby & Lil Baby) - Remix",Future,"Life Is Good (feat. Drake, DaBaby & Lil Baby) [Remix]",68,4iiWcajF1fEUpwcUewc464,spotify:track:4iiWcajF1fEUpwcUewc464,https://open.spotify.com/track/4iiWcajF1fEUpwcUewc464,https://p.scdn.co/mp3-preview/0ec243b93a219d369ed34082eccf1146edc2f50c?cid=01e5c3c39a334ae78bf5becf053ad2d5,https://i.scdn.co/image/ab67616d00001e024df9c60aa74fb72c1e07fd1d,https://i.scdn.co/image/ab67616d000048514df9c60aa74fb72c1e07fd1d,0.81,0.566,5,-8.33,1,0.433,0.107,0.0,0.122,0.582,142.069,315346,4,"say she want to eat sushi, i gave her enough to go shoppin' anything she want, she cashin' out without no problems how you gon' love a nigga that ain't got love for your mama? you can die today, it ain't gon' save me nothin' but drama (super)  workin' on a weekend like usual way off in the deep end like usual (like usual) niggas swear they passed us, they doin' too much haven't done my taxes, i'm too turnt up  pluto help me fight my demons off, know the usual i had put a chopper in her name and a ruger she hang on the block where i hang like a shooter throwed away a cougar, she didn't wanna leave treat her like garbage, my heart was on my sleeve should've chose better with your company at least why should i have love for her if you can get it out the creep? why should i have trust for you? you ain't get it out the creek why should i have love for you? you ain't kneelin' to my feet why should i be carin' when i know i can't be beat? see how the ice be glarin' when i come through and retrieve it's easy to know it's us if a body in the street too turned up and the plug talk swahili after i pay my taxes, i go richard mille in another tax bracket, you niggas beneath me who causin' a racket in jamaica on the weekend? half a ticket on vacation, i ripped up the receipt and she call me daddy 'cause my money long like stevie stay down with my son, right or wrong, fbg shit (freebandz) how you gon' be gang? you bang if you rich, what's in your bloodline? come in with some talibans, everythin' gettin' gunned down halloween gang in this bitch, shit gettin' scary three hundred thousand for the cheapest ring, cost a bentley truck, i'm legendary, lil' bitch hot, off the thermometer, lil' bitch hotter than fish grease, lil' bitch my ring cost a big b as well as my wrist i'm gettin' money like this, can't tell problems exist i wake up fresh every day like i'm goin' to take a pic hermes hit my main line 'cause they know i'm lit stuffed a hundred-fifty racks in your purse, lil' bitch and when i wake up, go surf in your pussy, hit  say she wanna eat sushi, i gave her enough to go shoppin' switchin' up my bitch, i leveled up and went exotic how you gon' love a nigga that ain't buyin' a birkin for your mama? you can die today, i swear i still won't break my promise (pluto)  make love on the weekend as usual take drugs, goin' up, oh, that's usual every time she come, big spender every time i put my chains on, big spender  it's cool, man, got red bottoms on life is good, you know what i mean? like   yeah, hundred thousand for the cheapest ring on a nigga finger, lil' bitch, woo i done flew one out to spain to be in my domain and audemar-ed the bitch, woo dropped three dollars on a ring, cost a bentley truck, lil' bitch, woo i was in the trap servin' cocaine, i ain't been the same since  i can't entertain all that flodgin' i ain't been the same since they crossed me you know how they do when you poppin' you know baby can't do all that talkin' i got fools tryna sue up in boston i got dudes tryna sue down in florida i got hoes in l.a., got a new boo from georgia a milli', saved up to give to my daughter over one hundred k to drew findling, my lawyer (let's go) six digits on cases, we beat it like tina (mmh) baby all on the tv, that's easy i mixed mid with the gas and i bought me a bimmer (yeah) now i pull up in ghosts, they ain't see me (casper) i know she gon' fuck, i ain't askin' (uh-huh) f&n like a prop, this shit plastic (phew) fuck around and get popped just for laughin' (boom) put that boy in a box, pick a casket i go take that ho to dior, pick a shoe (let's go) kickin' shit with your whore, that's my boo you can go put hardwood on the floor with the hoop (hoop) we like uppin' the score, we gon' shoot (ball) i never pick up when she call me (brr, brr) help the bitch start a business, she bossin' (uh-huh) like to wake up to sex like it's coffee (sex) big baguettes on my neck, this shit cost me cartier, audemar, audemar or the rolex (let's go) i been broke before, bet i won't go back when she walk through the door, take that iron, make her hold that (hold that) they ain't seen me go out like a ho yet (ho) you know these lil' niggas got ho ways make 'em come air it out like the old days (uh-huh) you a throwaway, baby, it's okay my boy off a pill, need an oj (yeah, bitch)  hundred thousand for the cheapest ring on a nigga finger, lil' bitch, woo i done flew one out to spain to be in my domain and audemar-ed the bitch, woo dropped three dollars on a ring, cost a bentley truck, lil' bitch, woo i was in the trap servin' cocaine, i ain't been the same since (woah)  spent thirty racks on a rap bitch, could've went and bought a brick, woah quarter million worth of chains, ask icebox, everybody lit, woah it ain't no coppin' deuces, nigga, that's your man, everybody get it, woah made a few mil', made a few hits, fuckin' everybody bitch got somethin' to lose so i stay with a shooter got game from a g.o.a.t., i know how to maneuver she kinda cute, really somethin' to do i got somethin' to do, so i gave her to pluto, huh hundred thousand for a body, go inside the house and everybody get it, huh got a plug on exotic, overnight 'em, floodin' everybody's city extra three-fifty, might buy me a richie this shit gettin' ridiculous, sip syrup wrong, get sick spot in toronto, just show me the real ones give me a few months, i'll be servin' the 6, woah rolls truck, four bucks, all white guts, call it good luck, woah neck lit, wrist lit, look, don't touch, reach, you get busted hop out a phantom, they think it's houdini seven-fifty one day, i bought two lamborghinis hundred racks spent on a four carat diamond i didn't propose, but i bought her a ring they had my bro, had to let that boy go he had stick to the code, he ain't tell 'em a thing, uh ballin' like we won a championship, yeah everybody get a ring, huh  yeah, hundred thousand for the cheapest ring on a nigga finger, lil' bitch, woo i done flew one out to spain to be in my domain and audemar-ed the bitch, woo dropped three dollars on a ring, cost a bentley truck, lil' bitch, woo i was in the trap servin' cocaine, i ain't been the same since, woo  hundred thousand for the cheapest ring on a nigga finger, lil' bitch hundred thousand on the cheapest ring on a nigga finger, lil' bitch, yeah hundred thousand for the cheapest ring on a nigga finger, lil' bitch, huh hundred thousand for the cheapest ring on a nigga finger, lil' bitch"
Nights,Frank Ocean,Blonde,80,7eqoqGkKwgOaWNNHx90uEZ,spotify:track:7eqoqGkKwgOaWNNHx90uEZ,https://open.spotify.com/track/7eqoqGkKwgOaWNNHx90uEZ,https://p.scdn.co/mp3-preview/43abb77afc35b8eced064a1b062921a13f5c7b15?cid=01e5c3c39a334ae78bf5becf053ad2d5,https://i.scdn.co/image/ab67616d00001e02c5649add07ed3720be9d5526,https://i.scdn.co/image/ab67616d00004851c5649add07ed3720be9d5526,0.466,0.548,5,-9.362,0,0.118,0.42,1.01e-06,0.113,0.423,89.815,307151,4,"round your city, round the clock everybody needs you no, you can't make everybody equal although you got beaucoup family you don't even got nobody bein' honest with you breathe 'til i evaporated my whole body see through transportation, handmade (g) and i know it better than most people i don't trust 'em anyways you can't break the law with them get some gushy, have a calm night shooters killin' left and right workin' through your worst night if i get my money right you know i won't need you and i tell you, (bitch) i hope the sack is full up i'm fuckin', no, i'm fucked up spend it when i get that i ain't tryna keep you can't keep up a conversation can't nobody reach you why your eyes well up? did you call me from a séance? you are from my past life hope you're doin' well, bruh i been out here head first always like the head first signal comin' in and out hope you're doin' well, bruh everybody needs you, everybody needs you oooh, nani nani this feel like a quaalude no sleep in my body ain't no bitch in my body  new beginnin's, ahh new beginnin's, wake up akh the sun's goin' down time to start your day, bruh can't keep bein' laid off know you need the money if you gon' survive the every night shit, every day shit  droppin' baby off at home before my night shift you know i can't hear none of that spend the night shit that kumbaya shit wanna see nirvana, but don't wanna die yet wanna feel that na na though, could you come by? fuck with me after my shift know them boys wanna see me broke down and shit bummed out and shit, stressed out and shit that's every day shit shut the fuck up, i don’t want your conversation rollin' marijuana, that's a cheap vacation my every day shit, every night shit, my every day shit (every night shit, night shit, night shit, night shit)  all my night, been ready for you all my night been waitin' on you all my night i'll buzz you in, just let me know when you outside all my night, you been missin' all my night still got some good nights memorized and the look back's gettin' me right   every night fucks every day up every day patches the night up on god, you should match it, it's that ko no white lighters 'til i fuck my 28th up 1998, my family had that acura oh, the legend kept at least six discs in the changer back when boswell and percy had it active couple bishops in the city buildin' mansions all the reverends preachin' self made millionaire status when we could only eat at shoney's on occasion after 'trina hit i had to transfer campus your apartment out in houston's where i waited stayin' with you when i didn't have a address fuckin' on you when i didn't own a mattress workin' on a way to make it outta texas, every night  droppin' baby off at home before my night shift, yeah you know i can't hear none of that spend the night shit that kumbaya shit want to see nirvana, but don't wanna die yet wanna feel that na na though, could you come by fuck with me after my shift know them boys wanna see me broke down see me bummed out, stressed out that's just everyday shit shut the fuck up, i don't want your conversation rollin' marijuana, that's a cheap vacation my every day shit, my every day shit my every night shit, my every day shit my every day shit, my every day shit my every day shit, my every night shit"
Alone,Petit Biscuit,Alone,58,4p1NHiFP4PfV7eW1183Ej9,spotify:track:4p1NHiFP4PfV7eW1183Ej9,https://open.spotify.com/track/4p1NHiFP4PfV7eW1183Ej9,https://p.scdn.co/mp3-preview/70a722cf16dfecfda5235acd78763d78e113ede7?cid=01e5c3c39a334ae78bf5becf053ad2d5,https://i.scdn.co/image/ab67616d00001e02c707141cbbae2c00bbc1a4dd,https://i.scdn.co/image/ab67616d00004851c707141cbbae2c00bbc1a4dd,0.772,0.745,11,-10.194,1,0.0405,0.595,0.87,0.117,0.166,116.014,273162,4,
Holy Water - Steff da Campo Remix,Galantis,Holy Water (Steff da Campo Remix),37,5L4qcZ6V7PeC1m3iGi6Ddz,spotify:track:5L4qcZ6V7PeC1m3iGi6Ddz,https://open.spotify.com/track/5L4qcZ6V7PeC1m3iGi6Ddz,https://p.scdn.co/mp3-preview/d165a4447e857f6d7784fab6ed05c63ad55c8a2e?cid=01e5c3c39a334ae78bf5becf053ad2d5,https://i.scdn.co/image/ab67616d00001e0205abd6c7edf472e096b04fc8,https://i.scdn.co/image/ab67616d0000485105abd6c7edf472e096b04fc8,0.702,0.859,1,-5.579,1,0.0554,0.028,0.103,0.107,0.38,126.04,190481,4,"i can't get down down from this high high as a waterfall if hearts could fly want you to breathe breathe next to me caught in this lullaby sing it to me  i wanna drown in your holy water you know a sin never felt so good i wanna drown in your holy water a-amen, a-amen (a-amen, a-amen, a-amen, a-amen, a-ah)  i wanna drown— (a-a, ah) (a-a)  i'm all shook up shook up on you we burn like fireflies burn baby blue  i wanna drown in your holy water you know a sin never felt so good i wanna drown in your holy water a-amen, a-amen (a-amen, a-amen, a-amen, a-amen, a-ah)  i wanna drown— (a-a, ah) (a-a)"
Patience,"Nas & Damian ""Jr. Gong"" Marley",Distant Relatives,49,5ZdVYZaMffiDf1plaJ2Jib,spotify:track:5ZdVYZaMffiDf1plaJ2Jib,https://open.spotify.com/track/5ZdVYZaMffiDf1plaJ2Jib,https://p.scdn.co/mp3-preview/7472cf79b46cd9a70f333f7aacd03eda976c7537?cid=01e5c3c39a334ae78bf5becf053ad2d5,https://i.scdn.co/image/ab67616d00001e026464d88f4a4cc33bac40030f,https://i.scdn.co/image/ab67616d000048516464d88f4a4cc33bac40030f,0.794,0.636,4,-8.093,0,0.0416,0.206,0.0179,0.0805,0.304,124.214,345093,4,
