track,artist,album,popularity_score,track_id,track_uri,spotify_link,preview,album_image_large,album_image_small,danceability,energy,key,loudness,mode,speechiness,acousticness,instrumentalness,liveness,valence,tempo,duration_ms,time_signature,lyrics
Drivin Thru the Night,Petit Biscuit,Parachute,52,6fagtLLzqZTaGcYcSa5qeA,spotify:track:6fagtLLzqZTaGcYcSa5qeA,https://open.spotify.com/track/6fagtLLzqZTaGcYcSa5qeA,https://p.scdn.co/mp3-preview/4f7b355098b29277719ef8e870f5e448dda377ad?cid=01e5c3c39a334ae78bf5becf053ad2d5,https://i.scdn.co/image/ab67616d00001e02bd454feb8295bfec9cdf210f,https://i.scdn.co/image/ab67616d00004851bd454feb8295bfec9cdf210f,0.546,0.586,9,-9.319,1,0.358,0.655,0.0222,0.0931,0.384,123.963,187333,4,"i'm drivin' through the night smoking a cigarette, windows down i'm feeling the speed so hard been living fast, i'm electrified i'm driving through the night smoking a cigarette, windows down i'm feeling the speed so hard been living fast, i'm electrified  i'm walkin' through the town citylights, i'm an insomniac i'm surrounded by a hundred sights i'm lockin' on one, oh, she blows my mind i'm hangin' out behind the club, yeah bass vibes elevate my soul this blue-eyed girl is getting closer and closer she's lit up by the rising sun  six am, time to move away she's holdin' me back, wants us to escape she pulled my arm with her cold hands, yeah we're runnin' like there's no time to wait we're drivin' thru the night she kissed my neck and she holds me tight i feel her heartbeat getting fast i'm lucky now (through the night)  through the night oh, oh-oh, oh-oh through the night night through the night oh, oh-oh, oh-oh through the night night through the night oh, oh-oh, oh-oh through the night through the night through the night  so how do you feel tonight? i'm searching for something that makes me feel alive (mm-hmm) and free yeah you know, love isn't the only thing that can make your heart beat freedom has no price freedom makes life worth living"
Gwana,Petit Biscuit,Parachute,49,41sHJRyvhs5thAUFVuG8Ui,spotify:track:41sHJRyvhs5thAUFVuG8Ui,https://open.spotify.com/track/41sHJRyvhs5thAUFVuG8Ui,https://p.scdn.co/mp3-preview/da884527eb5744ac3eed910ebe32424c37813df5?cid=01e5c3c39a334ae78bf5becf053ad2d5,https://i.scdn.co/image/ab67616d00001e02bd454feb8295bfec9cdf210f,https://i.scdn.co/image/ab67616d00004851bd454feb8295bfec9cdf210f,0.624,0.414,0,-12.805,1,0.0735,0.398,0.245,0.164,0.185,125.081,215067,4,
I Leave Again,Petit Biscuit,Parachute,66,4aNNFLoRfSOMHeYQXidsXL,spotify:track:4aNNFLoRfSOMHeYQXidsXL,https://open.spotify.com/track/4aNNFLoRfSOMHeYQXidsXL,https://p.scdn.co/mp3-preview/f64d4444242ff15963e7231c47a8344b1028171f?cid=01e5c3c39a334ae78bf5becf053ad2d5,https://i.scdn.co/image/ab67616d00001e02bd454feb8295bfec9cdf210f,https://i.scdn.co/image/ab67616d00004851bd454feb8295bfec9cdf210f,0.724,0.476,2,-13.832,1,0.0555,0.465,0.0451,0.0964,0.11,124.006,240893,4,"the sky’s so cold, i feel you slow your mind is not like it was before i delete all, put thoughts on hold i try to feel you but you are gone the fire’s cold inside your soul i feel the weight, of what we were i delete all, put thoughts on hold i try to feel you  (ooh, ooh, ooh) your eyes were bright i felt the shine miss the summers we used to hide the city lights on this blue night you used to tell me that it’s alright  i chill my bones, out in the cold walk the pathways we used to know these quiet towns we'll leave behind i try to feel you  (ooh, ooh, ooh, ooh) there’s no need to stay so it’s time to take a chance i don’t want to explain to my friends i leave again  i leave again and i leave again i leave again and i leave again i leave again (there’s no need to stay) (so it’s time to take a chance) and i leave again (i don’t want to explain to my friends, i leave again)  (ooh, ooh, ooh, ooh) there’s no need to stay so it’s time to take a chance i don’t want to explain to my friends, i leave again"
Hang On,Petit Biscuit,Parachute,49,382JSV4u3TvnoVcj1jdPt6,spotify:track:382JSV4u3TvnoVcj1jdPt6,https://open.spotify.com/track/382JSV4u3TvnoVcj1jdPt6,https://p.scdn.co/mp3-preview/6134a7d5c59dbb426287f2b1ffa0fb8c66084587?cid=01e5c3c39a334ae78bf5becf053ad2d5,https://i.scdn.co/image/ab67616d00001e02bd454feb8295bfec9cdf210f,https://i.scdn.co/image/ab67616d00004851bd454feb8295bfec9cdf210f,0.54,0.421,5,-11.89,1,0.132,0.289,6.08e-05,0.0941,0.0386,118.119,173560,4,"hey-hey, hey-hey, hey hey-hey, hey-hey, hey  hang on, hang on i can wash your pain away you won't have to press replay  memories fallin' from the tree you let me wash your brain now you've forgot who you've been  hey-hey, hey-hey, hey hey-hey, hey-hey, hey  hang on, hang on i can wash your pain away you won't have to press replay  memories fallin' from the tree you let me wash your brain now you've forgot who you've been"
Runnin,21 Savage,SAVAGE MODE II,86,5SWnsxjhdcEDc7LJjq9UHk,spotify:track:5SWnsxjhdcEDc7LJjq9UHk,https://open.spotify.com/track/5SWnsxjhdcEDc7LJjq9UHk,https://p.scdn.co/mp3-preview/5d0e6ec55530f3b250ee82c077760754efba3b20?cid=01e5c3c39a334ae78bf5becf053ad2d5,https://i.scdn.co/image/ab67616d00001e02aa57907bf0cb2ca0c8cc74bc,https://i.scdn.co/image/ab67616d00004851aa57907bf0cb2ca0c8cc74bc,0.819,0.626,10,-4.574,0,0.202,0.00748,0.101,0.167,0.415,143.01,195906,4,"am i really hard to please? perhaps i have such special needs i wondered what was wrong with me (haha) my friends all fall so easily (pussies)  called the first one savage mode, my mood, that's what it was (21) 2016, we was ridin' around, beatin' niggas up in the club i know she around for the money, but act like she loyal, i don't feel the love (21) i'm so rich, get bored, might wake up, buy me a car just 'cause (on god) her titties is hard 'cause she spent a five, my bitch titties cost me a dub (21) all my bitches got bbls, all my bitches got butts (straight up) i ain't with thе rap beef, draco pedophile, all of my opps get touchеd (straight up) we ain't never ran off on no barber, but we still be hoppin' out cuts (straight up)  runnin', runnin', runnin', runnin' runnin', runnin', i leave all my cars runnin', runnin', runnin', runnin' runnin', runnin', all my opps be runnin', runnin', runnin', runnin' runnin', runnin', wipe his nose, it was runnin', runnin', runnin', runnin' runnin', runnin', savage never did no  that clasé for your wife (21), that hookah for your wife (pussy) i'm slaughter gang, pussy, you know i brought my knife (21) he was talkin' gangster (21), we caught him at a light (pussy) i let my young nigga do it, it was free, he wanted a stripe (on god) havin' my way with the cheese, i'm in the den with the thieves (on god) i know that she ratchet, i could tell by the way that she wearin' her weave (21) smokin' on zaza, this shit came out the garden with adam and eve (21) chopper go fow-fow, shoot up your pow-wow, niggas tryna make y'all bleed (21) got out of line, spanked that baby, we had to rock him to sleep (pussy) is it a issue? keep me a pistol, i ain't finna diss you (pussy) all that pillow talk, i'ma have to send the boogeyman to come get you chain hang low like a yo-yo, your bitch ridin' dick like pogo  runnin', runnin', runnin', runnin' runnin', runnin', i leave all my cars runnin', runnin', runnin', runnin' runnin', runnin', all my opps be runnin', runnin', runnin', runnin' runnin', runnin', wipe his nose, it was runnin', runnin', runnin', runnin' runnin', runnin', savage never did no  i brought a hollywood bitch to club crucial (on god) i was at the met gala with my shooter (on god) slaughter gang, gang, we don't do recruitin' (21) say you ready to catch a body, gotta prove it gotta prove that shit, nigga shit ain't no motherfuckin' game, nigga get your bitch ass whacked, nigga big facts, big 4l, nigga big zone 6, nigga we run the motherfuckin' city, nigga y'all niggas know what the fuck goin' on, nigga body for body, nigga, money for money, nigga we skunkin' everybody fuck your crew, nigga, we'll kill your crew pussy, pussy, pussy (if young metro don't trust you, i'm gon' shoot you) are things better or worse the second time around? can we really do anything more than once?"
Glock In My Lap,21 Savage,SAVAGE MODE II,79,6pcywuOeGGWeOQzdUyti6k,spotify:track:6pcywuOeGGWeOQzdUyti6k,https://open.spotify.com/track/6pcywuOeGGWeOQzdUyti6k,https://p.scdn.co/mp3-preview/8c26b9fbea5e70687f8cf36ec056f95b7a962bc0?cid=01e5c3c39a334ae78bf5becf053ad2d5,https://i.scdn.co/image/ab67616d00001e02aa57907bf0cb2ca0c8cc74bc,https://i.scdn.co/image/ab67616d00004851aa57907bf0cb2ca0c8cc74bc,0.847,0.733,10,-6.439,0,0.16,0.00574,1.04e-05,0.151,0.202,130.029,193591,4,
Mr. Right Now (feat. Drake),21 Savage,SAVAGE MODE II,85,4Q34FP1AT7GEl9oLgNtiWj,spotify:track:4Q34FP1AT7GEl9oLgNtiWj,https://open.spotify.com/track/4Q34FP1AT7GEl9oLgNtiWj,https://p.scdn.co/mp3-preview/326f0913ac1d2852c806436f6d49deac449d7383?cid=01e5c3c39a334ae78bf5becf053ad2d5,https://i.scdn.co/image/ab67616d00001e02aa57907bf0cb2ca0c8cc74bc,https://i.scdn.co/image/ab67616d00004851aa57907bf0cb2ca0c8cc74bc,0.647,0.667,5,-5.563,1,0.304,0.231,0.0,0.133,0.704,172.08,193839,4,
Rich Nigga Shit (feat. Young Thug),21 Savage,SAVAGE MODE II,78,3ruoIF2UnoXdzK8mR61ebq,spotify:track:3ruoIF2UnoXdzK8mR61ebq,https://open.spotify.com/track/3ruoIF2UnoXdzK8mR61ebq,https://p.scdn.co/mp3-preview/eabfb4dad8b6fe4e6f60130c952113121878ab98?cid=01e5c3c39a334ae78bf5becf053ad2d5,https://i.scdn.co/image/ab67616d00001e02aa57907bf0cb2ca0c8cc74bc,https://i.scdn.co/image/ab67616d00004851aa57907bf0cb2ca0c8cc74bc,0.825,0.733,1,-5.625,0,0.0969,0.349,0.0,0.112,0.62,97.974,190331,4,
Steppin On Niggas,21 Savage,SAVAGE MODE II,68,7FtZFla3ZH6PqsAJ9MvVCM,spotify:track:7FtZFla3ZH6PqsAJ9MvVCM,https://open.spotify.com/track/7FtZFla3ZH6PqsAJ9MvVCM,https://p.scdn.co/mp3-preview/7434cc45063c0c6cbdee32f8cb849e78f762d783?cid=01e5c3c39a334ae78bf5becf053ad2d5,https://i.scdn.co/image/ab67616d00001e02aa57907bf0cb2ca0c8cc74bc,https://i.scdn.co/image/ab67616d00004851aa57907bf0cb2ca0c8cc74bc,0.849,0.635,7,-4.068,1,0.254,0.000608,8.44e-06,0.062,0.798,89.484,140833,4,
Brand New Draco,21 Savage,SAVAGE MODE II,71,4V9ynsDPwHtdItksqjuRu0,spotify:track:4V9ynsDPwHtdItksqjuRu0,https://open.spotify.com/track/4V9ynsDPwHtdItksqjuRu0,https://p.scdn.co/mp3-preview/7f0de62c967fdaefe2c4081bea0e66881502214e?cid=01e5c3c39a334ae78bf5becf053ad2d5,https://i.scdn.co/image/ab67616d00001e02aa57907bf0cb2ca0c8cc74bc,https://i.scdn.co/image/ab67616d00004851aa57907bf0cb2ca0c8cc74bc,0.697,0.709,11,-6.642,0,0.298,0.041,0.000296,0.0886,0.439,155.023,202420,4,"yeah (metro) we ain't giving out smoke, we giving out embalming fluid spin that shit every day, every night back to back to back to back to back y'all niggas can't even trap, nothing post up, nothing, kick with the hoes, barbeque, nothing we spinning back to back two weeks, three weeks straight, nigga, on god, nigga big 4l, pussy  rockin' ice like i'm tryna make a knot go down (21, 21) when the police hit the lights, i do not slow down (on god, on god, on god, straight up) brand new draco ready to crash like when the stocks go down (pyoom) i'm rich for real, i could press a button and make the opps go down (nah, facts, pussy boy)  maybach with the shade (straight up) brand new cts all red like the braves (on god) y'all just started slidin', we was slidin' back in the day (21) 21 gang, woodgrain on the k (21) big slaughter, nigga, big dagger in my face (straight up) ski mask, fuck a camera, gun him down on tape (on god) breaking news, fox 5, pussy, we don't play (straight up) i call my hellcat ovo 'cause it keep a drac' (facts) red dot, headshot, pussy doa (21) count me a ten in one minute, count a whole hundred in ten minutes (on god) niggas need to call they hood beyblades 'cause all we do is spin in it (on god) i own me a couple establishments, i ain't worried 'bout your business (21) y'all running 'round here gossipin', i'm tryna make me some more millions (pussy) ridin' with a stick in the hotbox, i ain't never put my phone in it (pussy) we call your main bitch pussy hood 'cause all we do is joan in it (pussy) money the only paperwork i put my bros in (pussy) somebody please unthaw my ears 'cause they frozen  rockin' ice like i'm tryna make a knot go down (21, 21) when the police hit the lights, i do not slow down (on god, on god, on god, straight up) brand new draco ready to crash like when the stocks go down (pyoom) i'm rich for real, i could press a button and make the opps go down (nah, facts, pussy boy)  charge him with theft by taking 'cause his drip stolen (pussy) trap spot in the neighborhood is 60 rolling (pussy) had to do cpr, i got your bitch choking (pussy) selling percocets, weed, bar, and cocaine so many choppers in the spot, we leave the door open (21) put the water in the pot, then you stick the fork in put some holes in your shirt, now it's red, soakin' (21) i ain't runnin' from no smoke, period, semi-colon (21) you wanna hold somethin', i got plenty shells (21) i don't even want no smoke, niggas gon' tattletale (on god) i don't even play with people's kids, go play battlefield (straight up) i'm from the east, home of the murders, you niggas'll die out here (21) they like to box, we like to pop, both of us bodybuild (on god) you can get hit with one of them guns from my adlib (straight up) you gon' fuck around and get chopped, lil' karate kid (pussy) i ain't seen him in a minute, but ask if god did (pussy)  saint laurent sweater rock balenciaga when i rock the barett-er (21) shout out robert kraft, fell in love with the cheddar (on god) beat a rapper ass, def jam vendett-er (bitch) when it come to shh, we got plenty eating ruth chris, i done burnt out on the beni' (21) and i eat, sleep, shit, fuck with the semi (on god) screamin' fuck friends, family first, rocking fendi (21)"
No Opp Left Behind,21 Savage,SAVAGE MODE II,70,50I7FNN2rl2rWiNwGxS146,spotify:track:50I7FNN2rl2rWiNwGxS146,https://open.spotify.com/track/50I7FNN2rl2rWiNwGxS146,https://p.scdn.co/mp3-preview/0b59cf4fdccb4e64b1995ef5e0a094be768a4470?cid=01e5c3c39a334ae78bf5becf053ad2d5,https://i.scdn.co/image/ab67616d00001e02aa57907bf0cb2ca0c8cc74bc,https://i.scdn.co/image/ab67616d00004851aa57907bf0cb2ca0c8cc74bc,0.823,0.703,8,-2.691,1,0.298,0.0161,1.35e-06,0.294,0.26,178.043,194214,4,"metro in this bitch goin' brazy  made it out the dirt, i was head first a nigga used to rob, ayy, and i used to serve couldn't go to work, school was the worst pussy tried to play me, ayy, put him on a shirt lambo real fast, fell in love with cash fell in love with head, ayy, i fell in love with ass science, i was 'sleep, ayy, i fell in love with math she was at the club, ayy, i made her take a bath ayy, i'm king smoke, so i got a drum on the stick gang was in there, i can't put my tongue on that shit he was talkin' crazy 'til that hollow hit his lip ayy, big 4l, even the killers gettin' killed all you see is pateks and aps in my clique wе got all the bottles and the hookah in thе vip i might be a rapper, but it's thirty in this clip ayy, zone 6, we get niggas buried 'round this bitch  pitbull the way i walk, way i talk loose lips sink ships, yellow tape, white chalk multitask, use the pistol and the fork screamin', ""no opp left behind,"" nigga, we gon' kill 'em all ain't no cap in my rap, ain't no flaw you could tell it when i rap, ain't no cut, this shit raw cut him off if he talkin' to the law i'm with draco 'cause he quiet 'til he hit you in the jaw  my lil' niggas don't wanna trap, they wanna spin ayy, spin, fill the choppas up, then spin again free my dawg, he not ink, so why he in a pen'? from atlanta, not vegas, but i still sin ayy, chain like a yo-yo, ride me like a pogo she from out of d.c., when she fuck me, she play go-go used to sip lines, now a nigga sippin' fours, though niggas rappin' gangsta, but they really hoes, though street niggas, streets don't talk, but you told, though rattail hangin' in the hood, boy, you bold bold we ain't tryna hear 'bout all the bricks that you sold sold they don't need a badge, but them niggas still the po-po focused on my bag, focused on my money i done had some dark days, i done had some sunny niggas think they hot, i think niggas funny ayy, yellow baguette, vv-vvs's look like honey all my diamonds pissed on, ayy, andre drummond my playa won't even pull inside the 'partments 'cause they haunted my dawg could've passed me the ball, but he punted got my turn, did a onside kick, that's how i'm comin'  pitbull the way i walk, way i talk loose lips sink ships, yellow tape, white chalk multitask, use the pistol and the fork screamin', ""no opp left behind,"" nigga, we gon' kill 'em all ain't no cap in my rap, ain't no flaw you could tell it when i rap, ain't no cut, this shit raw cut him off if he talkin' to the law i'm with draco 'cause he quiet 'til he hit you in the jaw  multitask, use the pistol and the fork screamin', ""no opp left behind,"" nigga, we gon' kill 'em all multitask, use the pistol and the fork screamin', ""no opp left behind,"" nigga, we gon' kill 'em all ain't no cap in my rap, ain't no flaw you could tell it when i rap, ain't no cut, this shit raw cut him off if he talkin' to the law i'm with draco 'cause he quiet 'til he hit you in the jaw  a wise man knows not to have a lot of enemies the friction of constant conflict is a distraction in life and left unchecked can end up being what subtracts him from life if possible, all enemies should be eliminated"
RIP Luv,21 Savage,SAVAGE MODE II,70,1wGnp7ejkCuXRsehXx0PNP,spotify:track:1wGnp7ejkCuXRsehXx0PNP,https://open.spotify.com/track/1wGnp7ejkCuXRsehXx0PNP,https://p.scdn.co/mp3-preview/5c080d5b3b28e71b10f079b28359ab58c3c1933d?cid=01e5c3c39a334ae78bf5becf053ad2d5,https://i.scdn.co/image/ab67616d00001e02aa57907bf0cb2ca0c8cc74bc,https://i.scdn.co/image/ab67616d00004851aa57907bf0cb2ca0c8cc74bc,0.63,0.399,5,-9.869,0,0.178,0.105,0.174,0.234,0.0657,183.016,214192,3,"yeah, rest in peace to love october 22nd, 1992 july 8th, 2009 (zaytoven) you will be missed forever (metro boomin wants some more, nigga)  rest in peace to love, i gave up a long time ago (long time ago, straight up) hard times, everybody left, i'm the one you counted on (i'm the one you counted on, 21) my shoulder took a lot of tears, woulda swore it was a fountain on (shit brazy) i be cryin' on the inside and smilin' when the cameras on (on god)  woulda never went against you ever (21) i even tried to make the grudge settle (straight up) yeah, i heard that you slept with a couple fellas (straight up) still treated you like a virgin because i know you better (on god) when she suck it, take my soul, she a whole devil (21) bought a wagon then i covered it with rose petals (skrrt) she didn't think i was romantic 'cause i'm so ghetto got a patek and a birkin, it was fundamental then the situation took a u-turn (fuck) foundation crumbled and the roof burned (21) i ain't perfect, i was slidin' like a earthworm, loco but i never, ever brought the dirt home (on god) man, we both played each other, you was worse, though (21) always blamin' me because i did it first, though (21) you started sleepin' with your phone in your purse, though and you had that pussy nigga fragrance on your skirt, ho (punk bitch)  rest in peace to love, i gave up a long time ago (long time ago, straight up) hard times, everybody left, i'm the one you counted on (i'm the one you counted on, 21) my shoulder took a lot of tears, woulda swore it was a fountain on (shit brazy) i be cryin' on the inside and smilin' when the cameras on (on god)  i had your back, you put a knife in mine (now i'm scarred) if you was finna lose your life, i woulda gave you mine (on god) i sit back and reminisce sometimes (just be thinkin', you know, 'bout the old days) i used to drink my syrup while you drank your wine (my old ways) can't believe what we came to (21) you won't believe what the fame do we ain't together, any problems, i still came through (straight up) heard he put his hands on you, that's what lames do (pussy) got my first taste of love and i thank you (thank you) savage, never let another woman taint you (21) fallen victim to my feelings, something i can't do (never) get revenge on every bitch, even if it ain't you (on god)  rest in peace to love, i gave up a long time ago (f-u-c l-u-v) hard times, everybody left, i'm the one you counted on (one, two, three, four, five, six, seven, eight) my shoulder took a lot of tears, woulda swore it was a fountain on (heavy rain, thunderstorm, hail comin', fallin') i be cryin' on the inside and smilin' when the cameras on (frown on the inside, laugh when the flash on)  truly genuine love never really dies but lust, infatuation, and unrevealed attraction are all things that over time rarely survive"
Said N Done,21 Savage,SAVAGE MODE II,69,11XegnWeJHBDtj9IsNwngu,spotify:track:11XegnWeJHBDtj9IsNwngu,https://open.spotify.com/track/11XegnWeJHBDtj9IsNwngu,https://p.scdn.co/mp3-preview/3ac5df0e8080f85ddc7f791aff7e15553a58c330?cid=01e5c3c39a334ae78bf5becf053ad2d5,https://i.scdn.co/image/ab67616d00001e02aa57907bf0cb2ca0c8cc74bc,https://i.scdn.co/image/ab67616d00004851aa57907bf0cb2ca0c8cc74bc,0.775,0.566,11,-6.661,1,0.283,0.0381,0.000341,0.127,0.479,160.351,231831,4,"(metro boomin want some more, nigga)  when it's all said and done, who you gon' ride for? who you gon' slide for? who you down to die for? i gave her my heart, she was tellin' lies, though sleepin' with my guys, though, that shit turned my heart cold i came from the bottom, i didn't have a dime, bro apartments with the blinds, bro, still got on my grind, though i know my mama proud, everybody fine, bro this shit took some time, bro, finally get my shine on  i done been betrayed, yeah, i done been backstabbed now i got my bands up and they who i laugh at riding in the demon, no, this ain't no scatpack and we carry big straps, i suggest you back back i just speak the truth, i'm not with thе rap cap can't wait 'til they free turk, mr. push-your-shit-back rest in peacе to larry, johnny b, and tay, man swear i had a rough past, feel like i grew up fast go to war about my dawgs yeah, the ones who pick me up whenever i fall all the pain i endured just to ball i'd give this shit away to be with y'all standin' with you, throwin' gang signs, do it matter? when them bullets start flyin', have fun, scatter he ain't have no business in that car, now he ready to tattle just got shipped the diagnostics and he on a platter got on long sleeves, but i still bear arms rockin' christian dior, nigga, i'm in rare form savage ball like '97, '98 jordan step back, shoot you in your face like i'm james harden  when it's all said and done, who you gon' ride for? who you gon' slide for? who you down to die for? i gave her my heart, she was tellin' lies, though sleepin' with my guys, though, that shit turned my heart cold i came from the bottom, i didn't have a dime, bro apartments with the blinds, bro, still got on my grind, though i know my mama proud, everybody fine, bro this shit took some time, bro, finally get my shine on  right hand on my glock, left hand on her coochie cock the chop, hit your top, nigga, bruce lee i'm the boogeyman, pussies can't spook me got your bm on my line talkin' 'bout, ""scoop me"" you know i got a soft spot for the hoochies i don't talk to bitches, bitches talk the bullshit i bought every pair of amiris in the boutique you know we want all the smoke, nigga, lucy i'll never fall off, i might take a break you know either way it go, my family gon' be straight still in debt from all the losses that i had to take when you out here tryna evolve, they gon' call you fake i can't turn my back on the gang no matter what i make i done took a lot of risks to make sure niggas ate superhero in my hood, i don't need a cape i be lost sometimes, feelin' like i'm runnin' in place  when it's all said and done, who you gon' ride for? who you gon' slide for? who you down to die for? i gave her my heart, she was tellin' lies, though sleepin' with my guys, though, that shit turned my heart cold i came from the bottom, i didn't have a dime, bro apartments with the blinds, bro, still got on my grind, though i know my mama proud, everybody fine, bro this shit took some time, bro, finally get my shine on  (metro) when all is said and done we can only judge, punish, reward, enslave, and free ourselves there will always be doubters and haters, but they only have the power you give them remain focused, move forward, and never lose faith in yourself until next time, stay in savage mode because anything else would be too damn civilized peace"
What Can I Do,A-Trak,What Can I Do,0,6U9DI9uIT0X5XJJBQrC0Xu,spotify:track:6U9DI9uIT0X5XJJBQrC0Xu,https://open.spotify.com/track/6U9DI9uIT0X5XJJBQrC0Xu,,https://i.scdn.co/image/ab67616d00001e02a64433e1237ae58a07de2af9,https://i.scdn.co/image/ab67616d00004851a64433e1237ae58a07de2af9,0.813,0.719,10,-7.992,0,0.0405,0.0508,0.873,0.048,0.62,123.989,375702,4,
